Article Title,Article Link,Article Text,Article Summary,Article Image
TTP ‘Broken Switch’ terror outfit behind deadly attack on Chinese in Pakistan?,https://timesofindia.indiatimes.com/world/pakistan/ttp-broken-switch-terror-outfit-behind-deadly-attack-on-chinese-in-pakistan/articleshow/109274823.cms,"A recent series of deadly attacks targeting Chinese nationals working in Pakistan has been attributed to a Taliban-affiliated terror cell , according to Pakistan police . The incidents have significantly strained relations between China and Pakistan, prompting urgent investigations and calls for enhanced security measures for foreign workers .Pakistan's police have uncovered that the attacks were orchestrated by a Taliban-affiliated group known as the "" Broken Switch "" terror cell.This cell has reportedly been active in the region and is responsible for planning and executing several assaults on projects involving Chinese nationals. The revelation underscores the ongoing security challenges in the region, particularly concerning projects associated with the China-Pakistan Economic Corridor (CPEC), a South China Morning Post report said.The attacks have raised serious concerns about the safety of Chinese workers in Pakistan, who are crucial to several large-scale infrastructure projects under the CPEC initiative. In response to the violence, Chinese officials have urged Pakistan to take stronger measures to ensure the security of their nationals. ""The safety of Chinese citizens employed in Pakistan is our top priority, and we expect the highest level of security measures from our Pakistani counterparts,"" a Chinese official stated.In the wake of these events, both Pakistani and Chinese authorities are discussing the implementation of stricter security protocols to protect foreign workers from potential threats. The focus is on intelligence sharing, the fortification of project sites, and the deployment of additional security forces to sensitive areas. These steps are seen as vital for not only protecting workers but also for ensuring the continuation of mutual economic projects that benefit both nations.The ongoing cooperation between China and Pakistan is crucial for the success of the CPEC, making the effective response to such threats a priority for maintaining strong bilateral relations and ensuring the safety and success of their joint initiatives.","A series of deadly attacks targeting Chinese nationals working in Pakistan has been attributed to a Taliban-affiliated terror cell. The incidents have significantly strained relations between China and Pakistan, prompting urgent investigations and calls for enhanced security measures for foreign workers. The attacks have raised serious concerns about the safety of Chinese workers in Pakistan.","https://static.toiimg.com/thumb/msid-109274811,imgsize-60494,width-400,resizemode-4/109274811.jpg"
19 killed in two days of Eid festivities in Pakistan's Khyber Pakhtunkhwa province,https://timesofindia.indiatimes.com/world/pakistan/19-killed-in-two-days-of-eid-festivities-in-pakistans-khyber-pakhtunkhwa-province/articleshow/109274332.cms,"PESHAWAR : The first two days of Eid festivities claimed 19 lives in different incidents in northwestern Pakistan 's Khyber Pakhtunkhwa province , a rescue official said on Saturday.As many as 326 traffic accidents, 187 fire incidents, 10 drownings and two wall collapse incidents were reported from scenic and tourist spots, including Naran, Kaghan, Swat, and Galyat areas, due to the huge rush during the festivities, a spokesman for Rescue 1122 said.In all, 1,499 people were provided emergency medical cover and many were moved to hospitals.At least 15 people celebrating Eid drowned when their boat capsized in the Indus River in Khyber Pakhtunkhwa province on Thursday, authorities said.The officials said they rescued 11 people alive and the search for the missing three was underway.","At least 15 people celebrating Eid drowned when their boat capsized in the Indus River in Khyber Pakhtunkhwa province on Thursday. 326 traffic accidents, 187 fire incidents, 10 drownings and two wall collapse incidents were reported from scenic and tourist spots.","https://static.toiimg.com/thumb/msid-109274347,imgsize-35170,width-400,resizemode-4/109274347.jpg"
"Two Pakistan soldiers, wanted terrorist killed in encounter in Khyber Pakhtunkhwa province",https://timesofindia.indiatimes.com/world/pakistan/two-pakistan-soldiers-wanted-terrorist-killed-in-encounter-in-khyber-pakhtunkhwa-province/articleshow/109269612.cms,"NEW DELHI: Two soldiers from the Pakistan Army were killed on Saturday during an intelligence-based operation in restive Khyber Pakhtunkhwa province . The mission, carried out in Buner district, led to the killing of a wanted terrorist named Saleem , also known as ' Rabbani '.The operation, based on intelligence reports, resulted in the elimination of Rabbani, who had a bounty of Rs 5 million on his head, for his involvement in various terrorist activities, extortion, and target killings.Additionally, two other militants were injured in the exchange of fire. The Inter-Services Public Relations (ISPR) confirmed the incident and highlighted the determination of the security forces to combat terrorism.The statement mentioned that Pakistan has experienced a rise in terrorist incidents, with KP and Balochistan being the most affected regions. These areas accounted for a significant percentage of terrorist attacks and security operations in the first quarter of 2024.","Two soldiers from the Pakistan Army were killed on Saturday during an intelligence-based operation in restive Khyber Pakhtunkhwa province. The mission, carried out in Buner district, led to the killing of a wanted terrorist named Saleem, also known as'Rabbani '.","https://static.toiimg.com/thumb/msid-109269831,imgsize-497891,width-400,resizemode-4/109269831.jpg"
Pakistani police search for gunmen who abducted bus passengers and killed 10 in the southwest,https://timesofindia.indiatimes.com/world/pakistan/pakistani-police-search-for-gunmen-who-abducted-bus-passengers-and-killed-10-in-the-southwest/articleshow/109268681.cms,"NEW DELHI: The Pakistan police have launched a search after gunmen abducted eight people from a bus on a highway in the country's southwest.Pakistani police are searching for gunmen who killed eight people after abducting them from a bus on a highway in the country's southwest, a police official said Saturday. Earlier, the same attackers killed two people and wounded six in another car they forced to stop.According to the police official, the abduction took place on Friday in Baluchistan province, which has long been the scene of an insurgency by separatists fighting for independence.Deputy Commissioner Habibullah Mosakhail said the gunmen set up a blockade, then stopped the bus and went through the passengers' ID cards. They took eight people with them, all from the eastern Punjab province, fleeing into the mountains, he said.Police later recovered eight bodies under a bridge about 5 kilometers (3 miles) from the highway. Earlier on Friday, the same gunmen had opened fire at a vehicle that failed to stop for their blockade, killing two and wounding six.A search for the perpetrators was underway, Mosakhail said. The bus was heading from the provincial capital of Quetta to Taftan, a town bordering Iran.Pakistani Prime Minister Shehbaz Sharif condemned the attack, expressing his ""deep sorrow and regret over this shocking incident."" He offered his condolences to the families of the victims and said he stood by them in their hour of grief, according to a statement from his office.""The perpetrators of this incident of terrorism and their facilitators will be punished,"" Sharif said.Abductions are rare in Baluchistan, where militants usually target police forces and soldiers or infrastructure.There was no immediate claim of responsibility for the killings. Police said there was no ransom demand and no indication of a motive for the attacks.Although the government says it has quelled the insurgency, violence in the province has persisted.","Pakistani police are searching for gunmen who killed eight people after abducting them from a bus. The same attackers killed two people and wounded six in another car they forced to stop. The abduction took place on Friday in Baluchistan province, which has long been the scene of an insurgency by separatists fighting for independence.","https://static.toiimg.com/thumb/msid-109269032,imgsize-67938,width-400,resizemode-4/109269032.jpg"
3 children killed in landmine blast in Pakistan's restive Khyber Pakhtunkhwa province,https://timesofindia.indiatimes.com/world/pakistan/3-children-killed-in-landmine-blast-in-pakistans-restive-khyber-pakhtunkhwa-province/articleshow/109268636.cms,"PESHAWAR : At least three children were killed on the spot and one injured in a landmine explosion in Pakistan 's restive Khyber Pakhtunkhwa province on Friday, police said. The tragic incident occurred in Wanna town of the tribal South Waziristan district on the third day of Eid.The children were on their way to watch a volleyball match between two local teams in the Mandokai area when one of them stepped on a landmine triggering a huge blast, a district police officer said.Three children died on the spot and one was critically injured. The injured child was provided immediate treatment at a local hospital before being shifted to a district hospital in Dera Ismail Khan.It was not immediately clear who planted the landmines in the area. However, South Waziristan is a hotbed for militants.",The children were on their way to watch a volleyball match when one of them stepped on a landmine triggering a huge blast. Three children died on the spot and one was critically injured. It was not immediately clear who planted the landmines in the area.,"https://static.toiimg.com/thumb/msid-47529300,imgsize-110164,width-400,resizemode-4/47529300.jpg"
"Pakistan: Gunmen abduct, kill 9 bus passengers after checking ID cards",https://timesofindia.indiatimes.com/world/pakistan/pakistan-gunmen-abduct-kill-9-bus-passengers-after-checking-id-cards/articleshow/109268346.cms,"with input from agency)

NEW DELHI: Nine individuals from Punjab were shot dead by unidentified gunmen after being abducted from a passenger bus in Noshki, according to several reports.Another attack on a different vehicle resulted in the death of one person and injuries to four others. Deputy Commissioner Habibullah Musakhel stated that a group of around 10-12 armed individuals blocked the Quetta-Taftan Highway N-40 near Noshki, seizing nine passengers from a bus.The gunmen stopped a bus heading towards Taftan, checked passengers' identification cards, and then abducted and later killed them. The bodies of the abducted passengers were discovered under a nearby bridge, with uncertainties regarding their belongings.The victims were identified as residents of Punjab province by Noshki Station House Officer Asad Mengal. In a separate incident on the same highway, a car was fired upon when it failed to stop, resulting in one fatality and four injuries.The vehicle overturned, leading to the casualties, as per Dawn. It was noted that one of the passengers in the car was the brother of Provincial Assembly member Ghulam Dastgir Badini.The attacks were confirmed to have taken place at the same blockade by Dawn.com's correspondent. Prime Minister Shehbaz Sharif strongly denounced the violence and demanded a detailed report on the incident, expressing condolences to the affected families.He assured that the culprits and their associates would face consequences, emphasizing the commitment to eradicate terrorism.Chief minister Balochistan Mir Sarfraz Bugti also expressed deep sorrow over the tragic event, vowing to combat terrorism with firm measures and thwart their malicious intentions. The government remains resolute in its stance against terrorism.",Nine individuals from Punjab were shot dead by unidentified gunmen after being abducted from a passenger bus in Noshki. Another attack on a different vehicle resulted in the death of one person and injuries to four others. Prime Minister Shehbaz Sharif strongly denounced the violence and demanded a detailed report.,"https://static.toiimg.com/thumb/msid-109268425,imgsize-23576,width-400,resizemode-4/109268425.jpg"
"Terrorists kill 11 in Pakistan, police search on for assailants",https://timesofindia.indiatimes.com/world/pakistan/terrorists-kill-11-in-pakistan-police-search-on-for-assailants/articleshow/109264793.cms,"NEW DELHI: Terrorists killed eleven people including nine passengers aboard a bus in Pakistan 's Balochistan province , as confirmed by officials on Saturday.The first incident took place when armed assailants intercepted a bus traveling on the highway in Noshki district on Friday. According to police reports, the militants forcibly abducted nine male passengers from Eastern Punjab at gunpoint from the vehicle.Deputy Commissioner Habibullah Mosakhail stated that the gunmen established a blockade, stopped the bus, and examined the passengers' identification cards. They abducted eight people, all from the eastern Punjab province, and fled into the mountains.Police discovered the victims' bodies approximately two kilometres (1.2 miles) away from the main road. According to senior local police officer Allah Bakhsh, who spoke to AFP, the individuals had been ""fired upon at point blank range"".The bodies were located in an area off the highway, indicating that the perpetrators had likely moved them from the original crime scene. Investigators are working to determine the motive behind this brutal act of violence and bring those responsible to justice.Mosakhail reported that a search operation was underway to apprehend the perpetrators.""Police and paramilitary forces started combing the area for the arrest of the attackers,"" said senior Naushki district administration official to AFP.The bus was traveling from Quetta, the provincial capital, to Taftan, a town near the Iranian border.There was no immediate claim of responsibility for the killings, and police stated that there was no ransom demand or indication of a motive for the attacks.","The first incident took place when armed assailants intercepted a bus traveling on the highway in Noshki district on Friday. According to police reports, the militants forcibly abducted nine male passengers from Eastern Punjab at gunpoint from the vehicle. The bodies were located in an area off the highway, indicating that the perpetrators had likely moved them from the original crime scene.","https://static.toiimg.com/thumb/msid-109264897,imgsize-681357,width-400,resizemode-4/109264897.jpg"
Attack on Chinese: Protesters in Pakistan block highway over suspension of cops,https://timesofindia.indiatimes.com/world/pakistan/attack-on-chinese-protesters-in-pakistan-block-highway-over-suspension-of-cops/articleshow/109259881.cms,"ISLAMABAD: People in Pakistan's northwestern upper and lower Kohistan districts blocked the Karakoram highway on Friday to protest the suspension of senior police officers over last month's suicide attack , in which five Chinese nationals lost their lives.The Chinese engineers , working on construction of a hydroelectric dam on the river Indus in Dasu region of Kohistan, and their Pakistani driver, were killed when an explosive-laden vehicle hit their bus in Bisham city of Shangla district in Khyber Pakhtunkhwa province.In a swift response, Islamabad suspended the police chiefs of Hazara division, Upper Kohistan and Lower Kohistan districts, security director of Dasu hydropower project and the commandant of Khyber Pakhtunkhwa's Special Security Unit, for negligence and security lapses .The suspensions prompted the residents of upper and lower Kohistan to stage protests and block the Karakoram highway that links Pakistan with China for two hours. The protesters said the attack took place in Shangla district of Malakand division, but senior officials of Hazara division were suspended by the federal govt.Investigations had revealed that the construction company, which was required to provide bullet and bomb proof vehicles for the Chinese employees, and was duly paid for it, failed to meet its contractual obligations. The bus transporting the Chinese engineers was not even bullet-proof, let alone bomb-proof, which is a requirement under the security SOPs.","Residents of Pakistan's northwestern upper and lower Kohistan districts blocked the Karakoram highway on Friday to protest the suspension of senior police officers. Five Chinese nationals were killed when an explosive-laden vehicle hit their bus in Bisham city of Shangla district in Khyber Pakhtunkhwa province. Islamabad suspended the police chiefs of Hazara division, Upper Kohistan and Lower Kohistan.","https://static.toiimg.com/thumb/msid-109259919,imgsize-35170,width-400,resizemode-4/109259919.jpg"
"Pakistan army soldiers storm police station, beat up cops over arrest of commando",https://timesofindia.indiatimes.com/world/pakistan/pakistan-army-soldiers-storm-police-station-beat-up-cops-over-arrest-of-commando/articleshow/109226661.cms,"ISLAMABAD: Pakistan army troops have attacked a police station and beaten up cops following a dispute over recovery of an allegedly illegal weapon from a member of a soldier’s family in Bahawalnagar district of Punjab.On Wednesday, several videos showing men in army uniform allegedly beating up policemen in Bahawalnagar went viral on social media. It showed bloody faces and marks of torture on the bodies of police officers.One video showed a man and two army personnel forcing policemen to kneel in a queue.Another showed a man sitting on the ground with a bloody nose.Sources said several police officers had raided the family home of an army SSG (Special Service Group) commando named Khalil on April 8, but the policemen were instead taken captive by the soldier and his relatives.A larger police force was sent to rescue the captured cops. After extricating their colleagues, police arrested the SSG commando , his father Anwar Jat, his brothers and his family’s female members for attacking a police party. The soldier and his relatives were allegedly tortured in custody and not produced before a magistrate for police remand.Reacting to the arrest and torture of the soldier, sources said the concerned military authorities intervened and registered an FIR against several police officers for keeping Khalil, his father and brothers, and other family members in “illegal” custody.Earlier, soldiers had arrived in seven to eight vehicles at the police station where the soldier and his family were incarcerated. They barged into the station and assaulted policemen with rifle butts and sticks. The station in-charge and his staff were beaten mercilessly, with visible marks left on their bodies, according to the videos.Deputy commissioner Zulfikar Ahmed Bhoon, district police chief Naseebullah Khan and army officers intervened to bring the situation under control and the matter was hushed up. But the soldiers’ conduct at the police station had already been recorded by social media bloggers.The footage drew outrage from journalists, politicians and rights activists. PTI leader Hammad Azhar said the Punjab police chief should have resigned immediately and claimed the provincial government was treating the matter as “trivial”.However, in a statement on X, formerly Twitter, police said the episode was being presented in a way to “imply that there has been fighting going on between the Pakistan army and Punjab police”.“When the unverified videos went viral, both institutions launched a joint investigation. Officers from both institutions reviewed the facts and peacefully resolved the matter,” the police stated.","Pakistan army troops have attacked a police station and beaten up cops. It follows a dispute over recovery of an allegedly illegal weapon from a soldier’s family. On Wednesday, several videos showing men in army uniform allegedly beating up policemen in Bahawalnagar went viral on social media.","https://static.toiimg.com/thumb/msid-109226674,imgsize-17270,width-400,resizemode-4/109226674.jpg"
Exodus to Thailand continues after fall of key Myanmar border town,https://timesofindia.indiatimes.com/world/south-asia/exodus-to-thailand-continues-after-fall-of-key-myanmar-border-town/articleshow/109262970.cms,"Numbers double

MAE SOT: A stream of people, some fearing air strikes, queued at a border crossing to flee Myanmar early on Friday, a day after the strategically vital town of Myawaddy near Thailand fell to anti-junta resistance that is gaining strength.The loss of the town robs the junta, already grappling with an economy in free fall, of vital earnings from border trade while strengthening rebel groups such as the Karen National Union (KNU) that led the assault on Myawaddy, analysts say.""I am afraid of air strikes,"" said Moe Moe Thet San, a Myawaddy resident who crossed to Thailand with her son, who is about five years old.""They caused very loud noises that shook my house,"" added the 39-year-old mother, one of those gathered at the single fully-operational border crossing at Mae Sot, who said the sound of bombs drove them to leave home, fearing for their safety.""That's why I escaped here. They can't bomb Thailand,"" she added.Thai Foreign Minister Parnpree Bahiddha-Nukara is set to visit Mae Sot, just across the Moei River from Myawaddy, on Friday to assess matters after Myanmar's embattled junta lost yet more territory in the latest round of fighting.Junta spokesperson Zaw Min Tun told Myanmar media some of its troops had surrendered because they were accompanied by their families and talks with Thailand for their return were in progress.He did not respond to a telephone call from Reuters to seek comment.Myanmar has been in turmoil since 2021, when the powerful military deposed an elected civilian government, triggering widespread protests it sought to crush with brutal force.Simmering anger against the junta turned into a nationwide armed resistance movement that is now increasingly operating in coordination with established ethnic rebel groups to challenge the military across large parts of the Southeast Asian nation.About 200 Myanmar military personnel withdrew on Thursday to a bridge linking to Mae Sot after the KNU said it had taken control of Myawaddy.But the Myanmar military may still seek to mount a counter-attack, supported by its air force, to regain the town, said Dulyapak Preecharush, an associate professor of Southeast Asian Studies at Bangkok's Thammasat University.""So there is a question about possible intensification of fighting in the coming days,"" he told Reuters.As fighting in Myanmar intensified, the numbers crossing to Mae Sot from Myawaddy doubled this week to about 4,000 a day.On Thursday, Thai Prime Minister Srettha Thavisin said the fighting in Myanmar should not spill into his country's airspace.In an interview with Reuters last week, Srettha said the Myanmar junta was ""losing strength"", as he pushes to open talks with the regime.Thailand, which says it is keeping neutral in the Myanmar conflict and can accept up to 100,000 people displaced by it, has pursued engagement, including aid deliveries, with its neighbour since Srettha came to power last August.Yet the junta could find itself stretched further after the Arakan Army rebel group warned it would renew an offensive in Myanmar's western state of Rakhine.Arakan Army chief Twan Mrat Naing warned residents of the Rakhine cities of Sittwe and Kyauk Phyu to relocate ahead of ""a decisive battle"", the group said in a statement.One of Myanmar's most powerful ethnic armed forces, the Arakan Army was part of Operation 1027, a major assault by three rebel groups last October that seized significant territory from the junta.","Thai Foreign Minister Parnpree Bahiddha-Nukara is set to visit Mae Sot, just across the Moei River from Myawaddy. The loss of the town robs the junta, already grappling with an economy in free fall, of vital earnings.","https://static.toiimg.com/thumb/msid-109263066,imgsize-1083275,width-400,resizemode-4/109263066.jpg"
